upload_id,transcriptions
467,good morning my name is Danielle Washington and I want to speak a little bit about this coronavirus pandemic that we're going through my frustrations about the situation is that two girls graduating this year one from high school and one from a grave and they both work so hard you know get to the point where it was time for graduation and dances and Proms and this would be the last time you seen if friends and it just hurts me to see them her and I really would love for them to house. So specially my daughter and I school to have that experience so the big problem and you know going away to school and meeting new friends it's just it's so hard it it just that it bothers me a lot my hopes for the situation is that I really would love put the to add and they will find a cure and you know people would stop dying them that's like one of my feels like you don't like I see every time I go out that on no efforts let me back up alright I suffer with anxiety really bad so little all it is that's going on when I go out I have to prepare the day I go out days in advance I have to do a routine of putting on certain clothes and you know and gloves and in the back as you know but other things that I feel like it's going to protect you and then wants to know that Mom can I have a list I get everything on the list and then when I get back in the house or so I kept at Audis on panic and I'm like washing my hands constantly I'm wiping the door knobs down up my daughter goes and then besides me having anxiety with me going out my daughter goes working and she comes in I'm like oh my goodness anything that she touches before after before she gets in the shower and wiping it down at like it's becoming too much for me from anxiety and I do have a therapist and I speak to her my therapist wants sometimes twice a week which helps me get through the things that I need to get through but yeah that's like what's been helping me and my family get through you know this crisis and some I have four kids in my home and they just 13 14 17 and 21 and up we will close I have a 27 year old Canon T's in Atlanta excuse me he's in a latitude in his master's degree and he actually was supposed to graduate May 5th and it's been canceled on my forgot about his graduation while I try to do that but yeah he's Eagle of frustrated I'm a little frustrated but we speak everyday and I give him a call with your words you know and it helps him and helps me to hear him to see him make sure he's healthy make sure he's doing fine and all the kids that are ahead of 13 14 17 and 21 we've been like we used to have movie night at least once a month you know the kids get their friends are busy and I have things to do and I have things to do what we make commitment at least once a month to sit and watch a movie together will last changed into once a week and it's bring us closer with talkin momoland he's helping us as a family actually is bringing us closer to the Mets of this crisis like it really has brought me and my children really close so you know and I think that's all I have to say thank you for allowing me to share my frustration Fizz hopes and my thoughts about the crisis thank you
467,"I have been blessed to work from home so we have gotten used to being thabkful for that. Being at home all the time has caused us to grow more fruatrated with each other, and even the house is starting to break down with the non stop occupying. 
Even theough all these challanges we have also shown a strong need to communicate in ways that never happened before. Saying thing like this is how I understood what you said is common place and it is doing wonders for the family. 
We all have a secret fear of what is going to be when thing open back up and how we will have to act but knowing now the strength we have together I hope tjat will continue even when we move outside back into the world.
Stay strong and try to look at things from the other point of view. It helps no matter what you say.
Stay healthy, be well, and for all those suffering feel inner peace and I hope you will find joy some day."
468,hi I'm supposed to be recording my fears frustrations and needs right now as well as what's been helping get through this crisis it's April 27th my grandmother died of the virus exactly a week ago from today time she was quite old and not well but not being able to be with her at the end or hold her hand could really see us so we would talk to her and hold her hands so she could find us find our voices instead she was alone in a dark room for the last month 6 weeks whatever it was really six seven weeks of her life alone in a room and then she got sick or she tested positive luckily she never got incredibly sick so there is a blessing in that she was just frail and old the weekend of a funeral luckily my children did get to very quickly going to the funeral parlor and Say Goodbye during her virtual week so they at least can kind of understand some of what was happening but it's definitely not anything you'd ever expect not to be able to like Barry the people you love no matter what how much is time in okay and you've made peace with a long beautiful life can't bury them you can't have a funeral can't go to church so I don't really know I have so many fears about my children not exercising not moving not going outside it's been raining for weeks it's freezing by New York City so cold and wet and gross it's really draining EXO many fears about their health and their activity of their brains because they're not getting activity their brains on those machines of games in the machines all day so frustrated with my spouse never ending fighting never-ending fighting I can't keep up with anything I am always kind I say I'm failing quarantine apparently I'm not supposed to say I stale quarantine how can you fail like there are no rules but it really feels like I'm doing it all worse than other people so that stinks I don't like getting F's on her report card so I don't know I have some friends so I would that I get a lot of laughter from there helping a blessing has been connecting with people who I haven't seen in years or talked to in a regular basis and now like fight we have the time and we have the motivation and it's like actually like the most fun is having Zoom calls with them and FaceTime chats so that that has been special that has been an interesting blessing and unexpected silver lining and I don't really know what else I don't know what my needs are I don't know I saw that everyday feels like a full are my little one asked the other day he said what day is it said Tuesday said Mama are there even such things as Fridays anymore and I said I don't even know if it's like I don't even know it's very young it's a very unknown time and both my two oldest kids will have their birthdays in quarantine next week they're kind of big I mean their kids but they're still bigger Milestone birthdays and it stinks really stinks and I have fear that no one will come up for their show up for their car parade and no one will care and they don't like they have they don't have very strong friend bonds tonight
470,hi I'd like to share my thoughts on the coronavirus situation and my fears are that you know it's taking a toll on this family mentally especially for my 14 year old and my 16 year old that they don't have the socialization that they used to while they were in school and it's depressing on the other hand it is bringing my family closer together I hope that they find a vaccination I hope they find a cure I hope that it stops spreading and I hope that we can open up the economy as soon as possible and get back to our normal life I really want to know get out what's happening next month the fear is the unknown and how everyday we have no answers but I am hopeful and the kids are hopeful and we are healthy so that does keep me motivated exercise keeps me motivated and encouraging the children to follow a routine helps in the situation thank you
475,hi I just wanted to share a little bit about some of my thoughts and feelings as a special needs parent during this time of quarantine and the covid-19 and IMAX so my oldest son is 10 and he has ADHD and three learning disabilities and is gifted and his school is has been up and running with e-learning pretty quickly since the quarantine started and my youngest son is 5 he is on the autism spectrum and he is in preschool and they are also offering e-learning I'm as well and so it has been a challenge temperature with both of them I'm also working from home and my husband is out of work and home kind of being the person to help with our kids and their school while I'm working so that we are all working together as a family to help her kids be successful I think for me one of the biggest things that has been a challenge isour younger son for sure he doesn't really like school to begin with has never really been a fan of going and so it's already been a challenge to get him to go but at least he was going and he was able to participate and most of the activities at school now that he's been home he has no interest in learning at all and for him School happens at school and play happy and it has been very difficult to make that transition for him my husband I've really been trying pretty hard everyday to get him to watch the videos that are being sent from high school and do the activities that are being sent and he doesn't have any interest in doing them and we've tried a handful of different strategies including visual schedules and person and reinforcers and I'm just picking their activities a little bit but it's not going so well so we're now I'm kind of starting over and thinking of Plan D I thinkwhich I think is probably going to consist of not doing any school activities from his school but just trying to do some of our own novel activities that he's not done before I'm hoping maybe that will help just to kind of keep the learning going but it's definitely been a challenge she's also super fixated on certain things and there's no distracting him they're all stuck in the house and there's nowhere to go and it's just been very very challenging so my older son has been a little less challenging but still challenges there too we just don't have the ability for one of us to sit with him one-on-one all day so we're kind of relying on his own concentration power and attention he thankfully does something's better on the computer which is good but he also gets distracted really easily and it's it's just been hard so he's not getting everything done that he needs to I'm only getting some of it soI'm grateful there's a lot of really thankful for that our school is providing opportunities for learning there's just a lot of pressure on us as parents while we're also trying to work maintain a household you know it make sure we have groceries and pay the bills and there's just a lot of pressure it's really stressful it's been a huge huge transition and you know I know there's a lot of things that are kind of going I'm done in terms of learning there's a lot of things that they're not doing that I really wish they were but I also find comfort in knowing that we're not alone. There's a lot of other people out there in the same boat people with neurotypical children and people with neurodiverse children that are may be struggling a little bit more so it's just helpful to know that we are experiencing this not in isolation even though we feel like we're in isolation and I hope that we will be able to recover and their children will be able to recover this last time in the floss killbut I'm sure we would really benefit from support I really I am providing Therapy Services cuz I'm a therapist electronically and I really wish that I had someone took to be that person for us because I feel like that would be really helpful but our service providers for our children are not able to provide that quite as much special for my youngest son during this time so anyways that's my thoughts and feelings I hope this helps thanks for giving me a platform to share our at my thoughts and yeah I want to thank you child MIND Institute for everything that you've done my oldest son has participated in your study and it was just a really positive experience for us thanks for your videos that are putting out the LA and just thanks for being there so thanks everyone teacher
476,"hi I guess this is recording now I'm happy to provide a small audio and enter participate more if that would help I have a 15 year old you wonderful kid she was already in cyber school when this started so we were fortunate in that she didn't have to make a significant change to her academics but heard a program that she went to she's in a pre-professional ballet program that's where she socializes that's where she gets her energy out for her ADHD that helps regulate her her schedule is extremely important to her staying healthy and this is really thrownher for a loop her and her friends they've been really adaptive and resilient because that night they get on with one another on house-party or one of those other social media hate me also use Snapchat of course in Instagram but the kids are really having a good time because she had a strong base in the strong network of friends and then they even expand that wall they have been in quarantine but just I know it's been a struggle for her it's not the same in addition she has a bunch of physical health problems so last year she was out for almost the entire school year having surgeries and recovering and so she lost her ninth-grade year and this is her 10th grade year and it seems to her and I would feel the same that is completely unfair that two years in a row her life was taken away from her she can't participate the way she wants to it's been also tough to manage a professional ballerina who goes from training 30 hours a week hard hard hard hard with extremely demanding teachers and and and inability to do it to nothing cuz they she can work in the homes you can work on our technique she doesn't absolutely amazing job motivating herself to do those things it's not the same as in person and just the other day about 2 days ago she really communicated that she was just sad little pure sadness that she was not going to go back to school and see and not having end of the year and I think that's related just to this year I don't even know if it's compounded by last year just she was having such a great life great time and to take to go from having like the time of your life living your fullest life as they say really doing is hard work and good work and good academic work and then having it all taken away from you that that is a trauma we during these ages we want them to learn if you work hard you put your all in your for your effort in your rewarded by the outcome that's consistent with the work that you put into it and so what they're learning is that isn't true there's a disconnect between you know I was going along doing what was a developmentally expected of me above and beyond for some of them and all of a sudden it could be taken away so I think that and in terms of rebuilding for the kids and we're starting at home now is to really even work from a trauma-informed perspective, developmental psychologists and I'm just thinking what we need to do is teach them to reconnect with her sense of agency to reconnect with their sense of control to help them kind of accelerate their identity process will they have this time to look inward think of who they are so that they have that strength to take with them when they come out of this is definitely a very difficult time and I don't think that parents have the time to deal with all of this right now and unfortunately you know it's the time when teenagers need their space very healthy space and to be in the pier world so that they can develop but they're with their parents and it's not that they don't love their parents just that they need to find out who they are separate from their parents so it's a very odd time she asks in all earnestness you know please predict when I think"
477,"I have anxiety about every sneeze, scratchy throat, or stuffy nose I have. I know in reality it’s my allergies but I lay awake at night thinking “what if this is it? What if I have the virus? What if I give it to my husband and children, and my 86 year old mom?” I am frustrated that there is so much schoolwork for these kids that are already having a hard time dealing with their normal routine being so abruptly ripped away and their social nature being deprived. I understand they have to learn, I just wish their could be more enjoyment and spontaneity in it with less structure. A lot of us have unhappy homes right now trying to teach them, work from home, keep some sort of organization in our homes, and keep our own depression and anxiety at bay. I have a text group with my mom friends where we vent, A LOT. I try to exercise to keep the stress level down, and I have a wonderful spouse to talk to. I also do virtual meetings with my therapist once every couple weeks to talk, which is really helpful. We try to have fun with the kids by having family movie night, hang in the yard, have fires and roast marshmallows, ride bikes/fly kites, and go for walks. I wish we could do it more during the week but there’s too much schoolwork."
481,"I had been struggling with lots amount of stress because of all the homework and classes which we must take part of. I feel like I have no free time for myself like doing exercise, singing, painting or even to have a nice and chill talk with my family. It's sad because I know we try to live as normal as usual (as a society I mean) even with the coronavirus situation but I also feel like teachers and my school doesn't understand that WE HAVE A LIFE also.
On the other hand, I have been dealing with some changes in my eating habits, like I don't eat too much because I don't have time to exercise so I am not able to burn the food I eat.  That's why I had ate less than what I normally would have been eaten if we were in the ""reality"".
In the case of my mental health, I had felt like the days are just the same, I make the same everyday, with the same problems and no solution, the same problem with my ""new"" eating habits, it's the right amount of food what I am eating?, it's too much, too little? Is my mom going to tell me what I eat less than usual... again??
I feel like I have no power in my days now, like this situation has gain the right to control my life and I can't do anything to make things right een when I know things are bad."
484,hi my name is Jacqueline Reza and I'm here to share my thoughts so today is April 27th and you just found out that the stay-at-home is going to be extended past May 15th and as I'm recording this I can hear outside at 7 everybody cheering on our essential workers are our doctors and nurses and grocery store workers and everybody that's got to go to work and how appreciated that they are at this point in time I've settled into staying home life my life the pace of my life has slowed down considerably and I'm actually not as worried as I was in the beginning we have sound of a good routine here at home our son is taken to learning online pretty well as long as we stay on top of themit's nice having all of us at home together since prior to this we really didn't see one another all that much except that night and you know on the weekends usually I was running around food shopping and stuff so currently I'm not that worried and I think that our son is feeling a little bit better he's probably more annoyed than haven't you know having us around as much as we are so he doesn't have quite so much alone timeanyway I'll come back and record more as time goes by adjust if I had any sort of here right now it just ECR us losing my job because I work in Real Estate Management and are tenants there don't have any money coming in because their businesses are not open so that affect our bottom line so we'll see where we are in a month that's it for now
484,"What are my students thinking about this pandemic? They don't say much. They express barely anything. Maybe it's easier for them to adapt to these circumstances. Maybe they suffer a lot. I wish I knew. Can they even comprehend what is happening? What will be the long-term effect? Will this make them selfish and cold and disrespectful to elderly? Or will this create better kids, better youth and an amazingly beautiful generation?"
485,in a way it's been a little easier with Corona and there not being any school because there isn't that pressure to get my son ready in the morning to the bus when she was never able to do on the mornings were like with a challenging could not get him to complete any tasks like getting dressed and eating breakfast and you know in the amount of time that was needed time to make it to the school bus so that has been used and school wasn't so easy for him in terms of socializing so you know
485,"Schools are still closed. This has been way too long for children to be home. Nowhere in media is it talked about how this prolonged absence from being in school affect students' well being. It almost feels like a surreal experiment. I am not so worried about lesrning. More so about social skills, fidgeting combined with ability to focus, and physical health. Some learning like basic skills and reading comprehension can be taught effectively remotely."
487,"It's incredibly stressful to know that we may not know for some time how this is affecting our children.  While it's fortunate that we live in a time where they can engage with friends using technology, it's not the same."
492,hi this is Lori real the Trap and my husband trap I am we're going to share some of our fears frustrations and needs right now as well as what has been helping us get through this crisis we are doing very well probably better than most and we're very blessed here what gets us through was Rd faith in God and our ability to help our family and others we are up financially solvent I work for the Department of Ed for 33 years and I'm getting a very good tension and now I will be receiving Social Security as I am 62 and my children will also be getting Social Security my husband receive Social Security and he also works teaching music I'm a licensed mental health counselor and I also do some counseling online and I also I'm up holistic entrepreneur night pursuing that increasing my business so we have you know we're in a really good position we know a lot about how's the wellness and we apply that to our own lives with lead as healthy as possible with high vibrational products and sell patches the kids take Vitamin C everyday we make sure we make sure they get out every day in the backyard we stay balanced which means they've been going to bed very very late but we've been vaping sleeping in so they've been getting the rest of the biggest fear would probably be probably share with the unknown or that one of our extended family members get sick we have several working on the front lines the frustration is what would you say this frustration is Carl what you say you may be for me going to the store and not being able to go about as as I like to you know things aren't available but we're pretty resourceful we don't need that much that's what we know we don't need so we're okay and we're also pretty self-reliance so we're doing all right we're doing all right. Two people so you know I try not to drink the Kool-Aid and buy into this year wishing and guidelines but not living that see if we don't listen to We don't watch the movie the newest a lot every other day I'm not sure how flip the stop button okay bye for now thank you
492,"Lonely, worried, disconnected"
497,hi been a little bit difficult being home and my child you know being a teenager
498,the Seahawks and feelings well my family is here my wife Sue and my son Mills who 17 and he's probably the least affected by the crisis of all of us might each public school so I'm making that transition to teaching here this way I'm trying to connect with all my high needs students out in a very crowded Public School in in Jamaica Queens a Title 1 school where everybody's broke half of my kids can't get on the internet and the other half that can are struggling to self-regulate to to modulate took to do the work that they need to do to learn but we're okay we're healthy and we're safe and we're okay I have been having like trauma in my mind is psychologically my dreams are really weird but I try not to be too dramatic about it because you know I'm alive and we're okay I did write a poem for NYC they had a poetry contest Coldwater the theme was with cold water month I mean what a difference a month makes my poem is called the row row or what a month of difference makes for pendente of dyslexics or maybe my dad goes like this I used to argue in my mind with Elliot and his muddy line about April being the cruelest month after all don't November and February call for cold consideration but this April this calling by drowning in your own blood April this viral dying alone April this false flattening April uncured and uncover this invisible droplet murderer this isolation at all cost killing a dozen eggs the nice lady at the grocery store April 6th in cracks open handed masked up month of stolen brats outside with drive-thru trucks testing Behind Bars and I've got to do that again cuz I didn't follow the text
