upload_id,transcriptions
499,"these are very nerve-racking and a present a time that have abruptly caused us to adapt to change and really take this time to spend our time with our families and do the things perhaps that we could not do due to working and Andy have to let them tend to usually have before we experience covid-19 has been some of the fears that I've had I've been guarding my children's education fearing for the chief mechanic job to extend and it has been quite difficult juggling with her home construction it and work but things gradually will and have to have to learn how to really, with our time and balance work and our children's also learning distance learning but I think some of the ways to deal with these fears are by communicating dinkleberg positive sharing your children when they're frustrated cuz it was very difficult to have a first what you started this is learning but she's come along and I think it's just a matter of patience and time that we need to have during a medical the 19 social things in my family has done and hope to cope with stressors that we're going out there to walk just making sure we wear a mask before the rules we have to be very conscientious of these times that we have to be mindful example of wearing a mask wash your hands constantly continue Norms to protect ourselves and our community specials are vulnerable and so working out your exercise of the trainee recipes cooking more with your children I have a daughter's teacher loves to cook and prepare dishes and desserts in my first grader to doesn't want to see them develop those are culinary skills and enjoy that and I've tried to even share this experience has been wonderful some of the things that we have to read it how to do a really out more fun activities in 2 starts with X Y Z with our families and their covid-19 so that's pretty much what I have to say and I just remain hopeful impatient that better things are about to happen hopefully"
503,biggest fears and worries that there's a lot of uncertainty about how we need to do this I will move out of this what will look what will normal look like after this I think that's a fair that I share for when I will have my kids and what happened to school what happened with a job that will what happened with our house and what will happen in this government I think that we have a totally in app and inadequate buffoon at the top of this and he does not has no idea what he's doing and because of that license in lost and I think that they're going to try to use this and this is a big fear of mine as a way to steal the election and try to stifle votes in and shut down voices and stillstill votes and so I think that if he keep our eyes open and make sure that we don't let this pandemic be a tool for a toy corrupt government to steal the election I think that's one of my biggest fears I think that we have to be diligent about the way that we're handling this right now known as a way to survive this was a way to prepare for other crisis in the future that wouldn't they come up we are or more prepared for what will happen cuz he will come up against the school just won't be the last time and so how we handle it now and the way that we take steps towards addressing it and handling is supporting our citizens and each other will be set a precedence for what was in the future not an important part of what happened to your so it's not just about going to beach with the governor of Florida or can't you help quickly to do get back to work can we set the steps that next time this happens to it will happen again there where she will handle more efficiency so it's not about what happens now economically or with with people jobs and with people's livelihoods and I'll tell you when this happened Who's online we have jobs that can be done from from from home we have an adequate food supply in PPE for the workers and we have all these things in place so that when it happened to do it won't it won't be a message in the Lost Society vaccine is found because I've a person when we get on the subway if there's not some type of plan in place and my back scene on sway or some type of treatment I'm going to go downtown to go to work if I go to Subway
523,"I feel like I'm drowning as a single-parent working from home. I'm not parenting the way I want while trying to juggle parenting, working, taking care of the home, and taking care of myself. I'm trying to decide if it's ethical to send my child back to childcare in my conservative state when we have people around us with compromised immune systems, but I also worry about the mental ramifications of being  isolated together. Having to choose between physical health and mental health is impossible, and I cry about it every day."
524,"Our family was just coming out of trauma from March of last year, so Covid was a continuation of crazy in our lives. My husband and I have been in counseling as a couple, and individually. We’re trying to keep our mental health at the forefront, so we can help our kids through these crazy days. It has been rough. I have a lot of anxiety on a good day, so Covid and trauma have really made things difficult. However, I’m thankful for counseling, medicine, and a community of people who know our story and are helping us through. It has been very eye-opening to learn just how many people struggle with anxiety, or how quickly we can become stuck in that emotion, when things like an epidemic come about. I’m praying we all learn to have so much more compassion for each other."
525,"My kids are doing reasonably well, but like for many of us, the effects won't be seen for some time.  They miss their friends.  Learning continues, because we're reasonably equipped to support them in this, but the lack of social interaction is incredibly stressful for them."
528,"The uncertainty is draining on us all. Will we continue to have jobs, be able to go to school, etc. When will someone we know die? It's like a constant waiting for the next shoe to drop and it's hard to be optimistic because we haven't gone through anything similar before. That said, I look for a silver lining each day -- we all DO have our health, our family, food to eat and a place to live. We are fortunate and hope our good fortune lasts."
530,play this is recording so my concerns about the coronavirus in particular or myself in my right so I'm a divorced single mother who has custody of her daughter 50% time but her father and his wife are normally we both live in Brooklyn he's Upstate so there's a lot of stress about how custody is shared and you know we're not sharing to our usual custody agreement so that has introduced a lot of stress people sort ofyou know in particular I feel like there's been some unilateral decision making about how to manage and so that in itself is introduced first and then taking care of Juliet are my daughter well she's here I feel like I can't give her the attention that she requires and deserves because I'm also working from home just left to her own devices and which is you know not horrible but she's already struggling to stay focused on school and when school is remote via the Internet and she has no one to stand over her shoulder and make sure she's engaging she doesn't and I'm worried about her academic achievement and continued development of persistent sore stick-to-itiveness I guess I'm also worried about her relationship with her peers because she can't see them in person she does do some FaceTime chats or you know plays games online with them but it's different than spending time in person and that I think what happened in fact and then ultimately I feel like this whole crisis has demonstrated the lack of commitment that American society has towards families and supporting I mean social safety nine you know so many challenges that you know I feel lucky enough to dodge many of them but it's really highlighted that for me and makes me really angry and I don't know what to do about that to it that makes it makes my patient's chart you know so it's working with Juliet it's a challenge and everything thank you
531,"As daily living of the corona virus, this arises great anxiety in the society. For me this has impacted my anxiety a lot in many different ways and the rising numbers do concern me. Please to anyone in public setting, keep your distance, ‘mask it like a boss’ and wash your hands regularly! For those (like me) who suffer from mental health issues Beyond blue is my recommendation to reach out when you need some support. I hope you are all well and safe, remember to look after your self well, practice self care strategies and be kind to the community around us. We can get this over and done with it everyone plays their part!"
533,"I am scared. I don't know what the fall will bring. My school district has put forth the choices for parents to make for their kids. I'm scared to go back to work. I'm scared about our financial stability if I don't. If I decide not to go back, I can't claim unemployment. I'm scared that if I do go back I will get sick and end up in the hospital as has happened to me before with less serious viruses. I'm worried I will unintentionally spread the virus to my family, or to the students I work with.
My students have no idea how to distance themselves. Over the last four years I've been licked, spit on, sneezed and coughed on, bit, grabbed, scratched, tackled, and the list goes on. The kids I work with are either in the SPED program or are on the radar for additional help in the classroom. Then there are the kids that need hand over hand assistance, or the kids who just need a hug or a high five. What am I supposed to do for them? I'm an adult and I am feeling the lack of physical contact with my friends. Some of the kids I've worked with desperately need hugs and cuddles.
I don't know how I will handle this fall, but I know I need to keep my family safe."
541,Stressed! My 17 year old daughter is not taking being in isolation well. Now we have been told that school will be online and that worries me because my daughter’s depression will get worse. I’m in the medical field and I have to work to survive so my daughter is home alone all day💔
543,this crisis has been difficult for everybody besides being a parent I also am a school social worker so after spending all day working with my kids school being on conferences with their parents attending meetings doing virtual counseling sessions 3:34 comes and I have to turn that off and turn on mom role because my kids my 5th grader and high school student need guidance being in the education field one of the frustrating things is that so much of the education is being done through text message or through I'm just watching the video that is nothing that can replace that interaction between the teacher and student in our kids I feel are going to be lost I'm alsoturn to that even if we don't go back this year and September rolls around once we're back in school setting and Society opened up again I'm concerned looking at history with other pandemics there's going to be another wave and we're going to be closed down again and what's going to happen to the children who lived during this. Of time and their education and their development I I feel they're just going to be so far behind with it so in many ways I I think they're going to suffer educationally I think emotionally I can't even imagine the amount of Crisis counseling when I get back to work how much PTSD we're going to start seeing so it's a scary time and none of us are quite sure how this is going to turn out once things return to normal or what that normal going to look like
544,"My child revealed at bedtime last night that he feels his life isn't going very well. He said this is because he feels very lonely and was tearful. He mentioned this a few months back but it has voiced this again. He is an only child. He has cousins nearby, one his age, but are limiting social interactions. He does talk with cousin over the phone while they play video games from time to time.

Also facing the challenge that my parent,has relapsed cancer. The new treatment has hard side effects."
545,during the shutdown and before the shutdown there's been a lot of you know hectic culture shock type feeling one of the biggest fears I feel in the community and was in my sausage job and stability right now I'm really lucky to be working from home until June 30th after that my department is closing so I don't really know what I'm going to be doing after that so that is a little scary because I've been trying to move out and gained some Financial Independence I live with my mother and and it worked out for us but we definitely need some time to ourselvesI'm some frustrations are frustrations are that you know sometimes staying at home with family is a blessing and it sometimes can also be a difficult everybody go stir-crazy after you know a few days let alone a month and this might last for more than three months or so so they're just some concerns and basically the life is on holes and usually a lot so you know there's some ups and downs but at the same time the kids really are missing being social and they're worried that they won't be able to see their friends or even go to camp this summer and do all of those things but they look forward to I am trying to do a lot of activities with the kids to keep us positive playing with the Pats and going out in the yard and taking walks I will have mass smile so that makes it feel a little safer when we do take the walks and you know trying to basically organize my life because I haven't had too much time for that my room is a lot more livable now has been for the last few years because I've been so busy with college and then work so there's some in there sometimes and I hope that everything ends up okay
546,last test of Firefox video 5 minutes Catalina Macos upload to transcript in word cloud 5 minute test what time is it 7:37 I'm not getting ready for dinner what should I wear where clothes are money okay I'm going to start the recording it over
550,this thing on hello hello low please share your feelings your fears frustrations and needs and wants and whatever else is helping you get you through this crisis your recording can be up to 5 minutes long you'll be able to save your recording for private use or share publicly but please avoid using any identifying names or information it will be transcribed by Google transcription service and you'll be able to view a word cloud created from the from the transcription we hope that you will come back and record more as a journal of your thoughts and experiences if you would prefer you can record audio or type text instead and that is that we want to capture your thoughts and feelings in a video on this wonderful website that is going to upload my 3 to 5 minute long video and you better display a really cool word cloud that I can put on my fridge later on today and I don't know how many minutes is Ben so I'm just going to hangout and in one minute we will work on something else why I wait for another 2 minutes so you want to say anything to thank everybody for today and is trying their best and working just remember we are in this together hashtag interviews today for schools in Baltimore city that something good hashtag Peach I'm glad the best word cloud ever so spend one more minute I'm going to give it another minute I just want everyone to take a second to breathe in and breathe out yeah think about things I can't think about something extinct for 4 think about something a couple minutes I'm blessed blessed blessed up I think it's probably been through up now it's been 3 minutes bye-bye
552,It's been most challenging these days trying to put everything online and also to try and engage students in different ways. It's hard as we can't see them F2F.
554,so let's see what's going on with my family during the coronavirus crisis I will say that I was started getting prepared very early as soon as I heard that this was starting to break out in Italy and you know I was really worried that was my United States so before the last week of February I made Costco runs at Wegmans multiple times got toilet paper and disinfectant and all kinds of things like that to try to really be prepared for a crisis and then basically by the 14th of March II was just like you know what we're leaving the city it was interesting because it's literally that. Is the week then that my office shut down my daughter's school closed and we came to Pennsylvania to stay with family and we've been here now for about 5 weeks I guess if you're crazy like we left the city and live somewhere totally different is kind of how it feels thankfully my in-laws in Pennsylvania have a separate carriage house that we can stay in and you know it's a little bit like glamping it's not fully you know our home but it doesn't have a working stove but bathrooms in microwave and so it's been fine and it's been great to honestly have space to let our daughter run around in and to havetwo extra people in the mix for us to share the responsibility of our two kids cuz we have a six month old and a seven year old so that's been really really helpful you know sharing meals and and just responsibilities my husband is doing distance learning for our daughter all day as well as taking care of my son you've lost all of his work which is really challenging but at least that's allowing him the time to be able to take care of the kids and while I'm working remotely like 9 hours solid today and it's kind of intense but it has at least I feel very very grateful that I have a job and that we have health insurance and that we can be away from the city and just you know kind of get fresh air if we need it outside although I'm literally locked inside kind of all day feels like and I haven't been able to like see my family more we actually have started talking my family that lives far away we've been doing Facebook chats and things like that which is really great and I don't know in some ways are a lot of positives of them out of it I hope that you know everybody starts to really think about the importance of Health Care and food security and all of that for people across the nation cuz it's so important yeah alright thanks
558,"These times have been so hard for so many reasons, but the forced closeness has been very challenging. It magnifies every problem, as the avenues of escape are very few, and even when they exist, with a kid around, taking a break just shifts the burden to the other parent. It's all zero-sum and brutal."
559,"We've been lucky. My wife and I are both still working at the same amount and pay as before, and our son has adapted really well to online learning. The pandemic hasn't directly impacted the health of our extended family, but it has made things much more difficult for our elderly (grand)parents. Their social outlets have disappeared, their doctors are much less eager to see them in person, home health aides are difficult to find and difficult to trust. Our family has gotten along with each other remarkably well being stuck in such close proximity and relative isolation for so long, but we miss seeing other people. We miss just going outside and playing in the park without masks and without setting ground rules for proximity with other families."
560,"As a parent to a very aware advanced 6 1/2 year old it's been really hard trying to do the balancing act of shielding him from the television or any news of the sheer number of deaths. 
Its very hard on him not being able to see his friends and be social but he does have an understanding that us staying home is for our wellbeing and safety. We pray when we need strength and to be lifted up. We play and enjoy each other's company as much as possible and actually have found alot of fun in our new found time exclusively together. I bake a lot and he loves to help, especially the tasting part! We play board games, create art, tell jokes and have epic movie nights complete with all the goodies and snacks! So all in all we feel very blessed to be in the few minority that has the means to actually stay 100% home right now during these trying times. When being stuck at home begins to weigh on us we just remember how truly lucky we are to have everything we need and want right now especially the gift of us all being together as a family safe at home.
We are making memories and getting through this together.
We do miss everything we used to do but also have learned to adapt to this new normal by understanding that this too shall pass."
564,hi there I'm not sure if I guess this is recording and the last I will say all began for myself and for my daughter we've been able to stay focused on following what is activist that means continuing to be safe following the the rules that are set before us and other words I would say things that we already were doing before this whole syndemics took place however it's just more intense and something not to take lightly make sure we follow the laws of wearing a mask especially when I'm on the train the buses you know stores my daughter doesn't really too much go out much because of her past history in terms of medically however we are busy regardless she has to therapy next happening virtually speech therapy that's happening virtually her counseling therapies happening remotely so you know we have not allowed for this unforeseen occurrence to slow us down in our lives life still must go on regardless of the situation it is sad to hear it's one thing to be ill for weeks but it's another thing to lose a life and that is the most hurtful part about it any of this stuff this is the loudest s and I believe they are humans that becoming so desensitized by death that it becomes just the norm and I wouldn't say all but it makes me wonder you know what are in people's minds and hearts 2 here's the amount of loss one's family friends strangers you and I've never even met within an hour and I'll circle with hearing about it you know and it's also a choice at the end of the day if you want to go and get checked even if you're not experiencing any symptoms I'm sure there are thousands of people who could have contemplated on doing that but they're like what if comes to mind what is EULA return back home to my loved ones what is will I have to stay in the parameters of ones that are experiencing what I'm spending some so there are many who are refusing you know when you're being told you can have it but no symptoms who wants to find out so I thought about going to go get that done you know for myself it does in the way you know he hasn't a little affected us. Evening to see the lights are not actually stopped but the things that we love to do but then there's a flip side to it you know it gives you more time to rest to do things that you weren't able to do before to reflect you know there's some good out of this unfortunately we can't forget about the pad but you make use of your time wisely and look around you but let me look around you are there any kind of questions on your head some people blaming God I have nothing to do with this not on this level is not responsible for the deaths no but anyway
567,"I think my biggest fears and frustrations through this time. Are just knowing that my child already is behind in school and also socially and this. Of not having you know her in school and also a limited social interactions I think will greatly affect her and then upcoming months it's also been somewhat stressful on myself because I feel like the school has put a lot of extra burden on us to do a lot of what I felt like they're responsible before and I don't feel like I'm really adequate to be able to homeschool my daughter or teach her the way that she probably is at school, I don't know their methodology so it's a little bit confusing and it does cause not only frustration with me but frustration with ustogether and I think you know also just for the both of us just not knowing when things are going to end or when they're going to be over it's difficult to know or just say when will go back to some of the things that we like to do what we want to do or when we'll take a vacation or when we'll be able to go to a store and buy new clothes or just do things that we like to do in that we enjoy as well as visiting family you know we had some family events that I'd be canceled because of this and not knowing exactly when we'll get back to that point to as well and then when we do also what it's going to be like because it's going to be differentso I think those are her major concerns also I think physical activity is been somewhat limiting cuz generally in the spring we start baseball or other sports programs and those of all been curtailed this year so yeah there's been a lot of frustrations and anxieties and you know we've we've had our moments definitely at home I'm too just interaction where your frustration levels can get kind of high but then on the flip side to I'm also like very happy that we had this time somewhat because it has brought us somewhat closer together I'm kind of cognizant of the fact that this time we'll end at some given point and then I wish that I have done something war of Wednesday or the other and will probably beat myself up about the fact that I probably didn't do as much as I wanted to buthoping to at least take advantage of the time that we have now that is extended that we don't normally get to enjoy time together as well so that's really about it"
