upload_id,transcriptions
10,so high our experience so far has been a little bit difficult when you have a teenage child that is stuck in the house for five to six weeks so far I mean homeschooling you know but her friends has been very hard to see them when you see them on FaceTime working from home is difficult or so after what I was wearing on you I wouldn't mind working from home maybe twice a week every day for six days at 6 weeks if that's difficult communicating it's it's just it's a very hard thing but I think it's been harder on my teenage daughter more she's more seems more secluded now and not as happy and I have to go outside and walk the dog occasionally so she can get fresh air and feel like she's able to do something I encouraged her to work but everyone needs some physical contact just to be around people I mean it's just nature but will hopefully get well soon and hopefully everything will be back to normal again hopefully everyone can stay healthy and safe
209,I'm not going to stay in my name for the anonymity but I am in my mid-forties remotely working from home working for a private Institution my world became very very active lately because of the market conditions and there are more demands and more work required for me to spend less time with my children when they need me I have three children I have a 5th grader ten-year-old I have a third grader a year a three year old and I have a Pre-K 3 4 year old my husband lost his King Kong because the service is not honor are not essential and therefore he's basically home yet he's a double or person who needs to be in the field and it became very frustrating on Olive my children are confused frightened their mental state is not as well because they're hostile we are living in a 650 square feet Apartment 2 bedroom and combine living room with the letter kitchenette that living species was fine with us for us in the past because children were doing all kinds of activities soccer running swimming and being constantly outdoorsy all of the discount now my oldest one is independent but he became depressed it doesn't move much in the morning we need to push him out of his bad to where he's doing his homework so he can stretch out a little bit my middle one he's the fidget one he's the one with ADHD he's not able to focus he's constantly finding toys for himself to play as opposed to doing his school work my husband needs to spend time next to him and constantly cure him back into the school work did my husband is not a teacher and english-as-a-second-language he doesn't even have a college degree I'm not able to spend any time educating my child because if I do not be if I'm not focused on my work I will lose my job and the only source of income for our survival my youngest one is basically being put in front of the TV so he doesn't bother my other two children who need to do the school work when he becomes tired of the TV then he starts teasing my other children where he becomes becomes very loud he throws the Tantrums he doesn't want to eat he's just looking for a Suites to suit him down and basically every day he's asking when he's going back to school and why he needs to stay at home all my children were used to do a routine going to school and literally running through the school yard and looking forward to meeting with their friends and learning something new every day in school in the social environment they enjoyed playing in the schoolyard after school and going into their activity everything was taken away from us I would like this lock sound be over I would want for our country to be opened as soon as possible and as an example looking at them Sweden who took the other way around exposing their Nation to the virus in a natural way in developing the immunity I understand the available in elderly needs to be protected and separated but for us and the children were not at risk they should go to school and an end have their mental state be looked at because this is Yvonne president and on them thank you very much for listening
216,so far I have been florentines now for about a month-and-a-half and it's been tough there seems to be I mean I've been in here in New York and it's been a pretty desperate situation it's been difficult to feel like I can provide some help at all and it kind of seems I feel somewhat helpless however following the news has been it's actually been pretty depressing it's been difficult to follow up and trying to stay away from the news I'm just to try to maintain more hope and try to keep myself removed from the date day of the the virus in the crisis as I don't in feeling that I I can't really help all that much I don't feel like there's any utility in my following the news religiouslybut that being said I have seen you know some hopeful stories from people and seen some some nice things that have enough kind of helped out through the crisis and it's it feels like people are coming together and in a certain way and I hope that people are kind of are realizing that things are unfair in life and in the way that our society works and that's that they don't need to be unfair that we can that this is something that that can be fixed and I hope that that's that's happening however I have my doubts and I worry thatwe'll come out of this is the further entrenchment of class and moneyed interests and in the further entrenchment of the disparity between the ruling in the wealthy class and the rest of us I'm however I also have hope that this is going to kind of wake people up in that this will be the impetus for major social change as it has in the past and I hope so I am hopeful for that however I know that there's is a lot sitting in the way of that sin a lot that. That could prevent that and that's scary because moving forward from this I think that's this thing's could only things can get much worse going forward and I think that the entrenchment of capital and of money to interest will continue and what will consolidate even further as a result of this and if it does then it's going to be even harder to break through that but we're able to to move past that into to wake up and establish a collective conscience and among working people and I think that we can make it through this
222,it has actually been a very difficult. Trying to get adjusted to changes the school system's now became online jobs people have to start working from home sometimes and some other times they have to work at the exact location worrying about family members whether they're okay or not and then family members on the Frontline worrying about them as wellit's been very difficult to me that sounds like China's involvement and I wish the government would do something about a good down to the root of the problem because too many times with the guy versus from China and what is going on
228,so this whole situation has been strange for us we feel very lucky because while we've been laid off or unemployment has with the additional money coming in at least been close to what we were used to making so we're not feeling the strain financially as some of our friends and family are and we're very grateful for that however I think right now because we can stay at homeour biggest fear is what comes next right now we're not scared that we're going to get sick because we are following the guidelines and staying home as much as possible but what worries us is what the world looks like next what the next steps are it makes me nervous to have to send the kids back to school and it makes me nervous to know what it'll be look like going back to work I work as a server in a restaurant and I'm not only worried about what it'll be like workingit in a restaurant during the aftermath of covid-19 but also financially what that'll look like and what our world in general will look like so while we feel lucky at the moment we also feel a little bit stressed out about what the future holds
246,my name is Simi and since the covid virus has come out I have a senior in high school who is depressed his graduation is cancelled from senior college shirt day has been trying to keep busy he lost his job so I did take your advice and I ordered some puzzles and a bunch of games for family activities which have been very helpful he really enjoys mankala and then my other son is in college who came home early becausebecause the college is on closed he is depressed not working just home with really no ambition or motivation I had the coronavirus and so that was challenging in the house with the kids just being kind of quarantine to my room and not feeling well and being able to go to the store quick note my husband did get a job he was unemployed so financially that was a big help andhistoric winning cuz it turned off so I think that that is about our experience with it
342,My fear is that my son will be emotionally impacted by the virus. I worry that he could develop fears associated with this. I fear for my loved ones who tested positive and pray that they will get better. I am scared to take my children outside especially now that the Kawasaki disease is linked to corona virus in children. What has been getting me through this is volunteering as a crisis counselor and taking two long walks a week while covering my face with a mask. I hope and pray we survive this pandemic and can go back to a safer new normal.
349,"Teachers are struggling to support students remotely. This introduces challenges in preparing educational materials that translate from the classroom to a computer, and competing with the distractions they and their students face at home."
376,"I personally hate Distance Learning. I hate that I am missing my 8th grade graduation, I hate that I am missing all of these fun activities that we do at the end of the year, such as Hamilton, Great America, etc. It sucks that I cannot interact with my friends. I Zoom call, but it is not the same. COVID is nobody's friend, but despite how much I have, I still complain to my friend, who has her own issues going on, on top of listening to my issues. But she listens nevertheless, and reassures me...I feel like there is something she isn't telling me-she has been pretty distant with her text messages lately. So I worry for her, I worry for myself and my family, I worry for all pf the frontline workers. This whole thing sucks, but I know it is much better than the alternative."
392,"I feel anxious often and unsure about my abilities as a teacher to meet the needs of my students in this new virtual setting. I see parents struggling with their new roles of trying to manage their childrens studies, work and continue keeping the household together. I struggle to keep up with learning all of the new technology necessary for our changing world. I wonder if I am doing enough. I find it hard to communicate on zoom sometimes. I miss the classroom and being surrounded by children. I became a teacher because I love children. I love to be around them. I feel invigorated by their excitement for life and the wonder they have for learning. I see my students struggling. They miss their school. They miss their friends. I have learned a lot through the pandemic. I have learned how strong we all are and how creative and innovative we can be. I have learned to collaborate and the importance of sharing our feelings. I feell uncertain about the future. But I am certain I will continue to support families and children as we get through this together."
394,"The ambiguity surrounding this virus creates amxiety, confusion and irritation. When will schools open? Will there be a vaccine? Could a second wave happen next school year? I think schools and the government have to be as clear as possible and inform better. Communication builds comfort."
395,"This quarantine is so difficult for teenagers, who should be learning how to be independent young adults but instead are stuck at home with families. What I have not seen addressed is how especially difficult it is for only children. They are all alone with their parents. No other kids to interact with or break the monotony. A school guidance counselor suggested virtual hangouts, but my teen finds that a very poor substitute for spending time with friends. I would appreciate it if someone would address how being an only child increases the isolation of these difficult days."
397,"Trying to work with focus while feeling guilty that my daughter isn’t being mentally stimulated enough, without schooling."
406,I’m pretty bored. And I miss my friends. And I’m nervous for what lies ahead and how this virus will effect my future.
410,I fear that we will not be able to enjoy a normal summer due to the corona virus. I wish I was able to go outside and hang out with friends without having to worry about a global pandemic. It’s also frustrating that teachers have given more schoolwork than usual because we’re at home. Whats been helping me get through this is the fact that i’m able to facetime my friends and use my phone to contact the people i’m closest with.
412,I miss my family. I’m the only one living in the US in my family and everyone is on the other side of the globe. We follow the news of each other’s countries and not being apart makes us worry about each other. We remedy with constant face time. I look forward to seeing my family when this is over.
413,"I spent the whole week tutoring and teaching via Zoom and never talked about the virus with my students. I allow them to be in that bubble away from news updates. 

Of course I think about whether that is the right strategy or not. 

The students seemed ok and motivated. They never asked any questions or shared any thoughts about the pandemic. 

Again, may be this crisis us easier on them than us. Or may be we express emotions and concerns better than they do."
415,"I am afraid that the country is irrevocably changed and things will never return to “normal”
And I might not want some things to return to the way they were (we can do better), but I do want them to return to a feeling of normal. 
I’m worried about losing my job or having to let my employees go. I’m worried that this will create a life for my son that I never imagined or wanted and I can’t give him the life I planned for him."
417,This has changed my life forever. In negative and positive ways. I have a 18 month old daughter that I'm so worried about. She doesn't have other children around which I'm worried will affect her in the long run. My husband and I moved to my mother and step dad house when she was born due to financial problems. My whole family is scared and cramped. Luckily all three work. However I'm alone with my daughter all day with no break. I am bipolar so the fear and anxiety is double the average person. Love has kept me strong throughout this pandemic. It has also strengthened my family in many ways. I just wonder what world will my daughter grow up in?
422,"I'm an expat working in Malaysia. Now I can't go back to my country and don't know when I can. My boyfriend can't visit me here also. I can go out theoretically but if I do go, I have to go through 14 days quarantine in Thailand. It's impossible for me to do so. 14 days are greater than my annual leave quota. I miss him so bad."
423,"I need a break. My husband works out of town and has only come for 5 days the last two months. I get a break when I go out for groceries or other occasional chores. I also work from home. It feels like I am constantly doing, doing, go, go, go. I just want alone time to just be, no duties, just be."
425,"For me during COVID there were two opposite reactions:
1.fear for friends and family that something can happen with them and I won't be able to help, as much as I could;
2.frustration, that I could help only with some data analysis, rather than with a real physical help;
3.at the same time, i finally had time to work on research projects and articles I could not work on before confinement, i managed to continue and advance some projects with far-away collaborators, since ""far"" became a bit closer."
430,I am grateful that my family is healthy. I am thankful for this time with all my children. They are young and growing fast so I’m slowing down to enjoy them as they are. More than anything I feel anxious. Some days I feel like I’m holding my breath all day just waiting for bad news. I am tired. More tired than I’ve ever been in my life. I am angry that this is happening and will continue to happen because of decisions that are outside of my control. I am sad that my kids are missing school and friends and cousins. My twin babies are changing each day and no one gets to see them. I am resistant to this “new normal” while also following all the guidelines religiously. I feel confused and scared.
433,"I am worried about the school kids not going outside at all. It's been 2 months now without school and many studemts here in New York City and suburbs have not been out once in 2 months. That to me is extreme. Many of them cramped up in small apartments. What are the emotional, physical and spiritual effects of such lack of outdoor activities and socializing. Was it even worth it to close the schools? Some countries never did. What damage has been done?"
435,"I’m a woman, aged 63 (almost 64) and still working full time because of the change in the pension age. I was hospitalised with Swine flu in 2009 and it had a big effect on my health. I was diagnosed with asthma in 2010. My lungs have never fully recovered from the severe case of Swine flu. 
I normally work nine to five and there’s have been times over the past two years when I’ve felt very tired and weary. But it wasn’t until this pandemic hit that I actually felt old for the first time in my life. I’ll admit that I went into a blind spin panic when I realised how bad this pandemic was at the end of March. Stress being one of the triggers for my asthma, the feeling of dread and tightness in my chest caused my asthma to peak. I remembered how ill i was in 2009 and the feeling that I just wanted to die and due to my weakened lungs I couldn’t shake the fear. I rang my doctor (not wanting to visit the surgery) and she advised I double up my asthma medication and issued a prescription for extra supplies. My son went to pick it up from the pharmacy the next day, only to discover they couldn’t get supplies of my usual medication. Another call to my doctor and she prescribed an alternative to the medication I had been on since 2010 and my initial asthma diagnosis. A few days later my wheezing had eased but I found I was suffering from severe reflux at nights. So bad it almost choked me on a few occasions, thus adding to my considerable stress. Another call to my doctor, who said the reflux was caused by stress so I was given acid suppressants and signed off work until everything could settle down a bit. I work for a train operating company so I am considered a key worker. 
In summary, I have found the last six weeks to be the most stressful weeks of my life. I’ve always considered myself to be as fit and able as my younger colleagues but this crisis has made me realise I need to take better care of myself and not put my job first. This virus has reminded me that I am getting old."
436,screen and now I'm going to do a test for Harold let's see if that this transcribes and creates a word cloud cloud cloud cloud cloud test for Harold Harold Harold Harold
436,"It's now 2 months into quarantine. I had a bad anxiety attack last night. It was the first since this has been going on. All the uncertainty of the future hit me suddenly. It's hard to make a routine for the day when I can't even take my kids to the park. They miss playing with other children. It's not the same for my preschooler doing any of his work or seeing his friends through a screen. Online learning isn't something that works for my preschooler. My 2 year old doesn't seem to be affected as much because he doesn't understand what's going on. Hours have been cut at both of my jobs in the ER because it's so slow, so money is becoming a worry. My husband has been able to work his normal business hours and get out of the house more, but who knows if that'll ever change. It's hard to talk with him about my concerns because he deals with things internally, whereas I need to talk with someone, but you can't even have a face to face with a counselor. It's insane to think that living literally stopped this time whereas this never happened before with anything else in my lifetime, from swine flu to even 9-11. Does hiding out and living in fear stop this virus from spreading further? Why couldn't people wash their hands before? Thousands of people die of the flu every year, but why do people still go to work sick and not care then? Did the media and politics really drive us into this? How do we get back into living?"
441,"I'm a single mother of a 13 year old. I am fortunate to still have a full time job, but unfortunate to not be with my son to be with him in this very difficult time. While I'm at work he's alone most of the time (just with our dog which might help him a little bit). His father, my husband, passed away 6 years ago so he's gone through a lot already. His dad's grandmother is 66 and has some health problems so she comes to see him on most days when she can and stays for a while in the afternoon until I get home. I'm grateful to her for that, but knowing that he's not in school and doesn't spend any time with his friends makes him sad even though he doesn't tell me. He's not motivated to get his grades up in school because he knows that he'll get promoted to high school either way. I know that that's true, but I tell him that he still should do his work because high school might be the same way it's being taught now and it would be better if he's used to it. That's when he gets frustrated and starts to cry. (This has happened a few times in the past). I don't know what to do so I stop talking and just try to listen to him. That's all I do. Don't know what else to do."
442,"It has been very challenges for us. In the beginning of March, I have been diagnosed with breast cancer. Cancer diagnosis along is lonely and frustrating, especially if you are under 40 with kids ( I feel I am the youngest one in cancer center) and then COVID-19 happen. My treatment plan got impacted but at least I am getting some treatment and doctors are doing everything to help me. Additionally, my mom's knee replacement surgery got postponed and she is now can only jump on 1 leg... My FIL surgery to reverse colostomy bag after his cancer treatment is post postponed and we cannot see my in laws as we are afraid of COVID. My 5th grader will miss his graduation and misses his friends who will be going to different school next year. My preschooler is very active and I am thankful that we have the backyard. So it is a lot to handle. On top of it, both my hubby and I are working from home now. We do not have private office at home and since we are working for non profit international organization, work load increased. We are lucky enough to stay employed during this time and my employer is very flexible for me to take time off for treatment. We also have big family and good friends. We do zoom meetings with cousins, friends, etc regularly. We also do virtual zoomba classes and  exercise bike. We spend a lot of time on our backyard. We are cooking and baking more which is good because I cannot loose weight to continue with my treatments. Our 5th grader became less picky eater and tries everything now. We do family movie nights, gazing the stars nights, backyard clean up party., dance away party and during the day when i do not feel well, we play who takes best care of mommy game. It helps that kids' teachers have meetings with kids so they can feel connected. Our son goes to SKYPE Saturday school for extra activities and our daughter does hip hop classes over zoom. We also"
